Name,Rating,Latitude,Longitude,Address,Tags
Blarney Stone,4.6,51.9290491,-8.5709865,"Blarney, Cork, T23 Y598, Ireland","tourist_attraction, point_of_interest, establishment"
Blarney Castle & Gardens,4.7,51.9290922,-8.570884699999999,"Blarney, Cork, Ireland","tourist_attraction, park, point_of_interest, establishment"
Rock of Cashel,4.6,52.5200763,-7.890452199999999,"St. Patricksrock, Cashel, Co. Tipperary, Ireland","tourist_attraction, point_of_interest, establishment"
Kilmainham Gaol,4.7,53.34187009999999,-6.309804799999999,"Inchicore Rd, Kilmainham, Dublin 8, D08 RK28, Ireland","museum, tourist_attraction, point_of_interest, establishment"
National Gallery of Ireland,4.6,53.3408887,-6.2522962,"Merrion Square W, Dublin 2, D02 K303, Ireland","art_gallery, tourist_attraction, store, point_of_interest, establishment"
Ireland's Oldest Bridge,4.7,53.5560825,-6.7910203,"Bridge St, Townparks North, Trim, Co. Meath, Ireland","tourist_attraction, point_of_interest, establishment"
Powerscourt House & Gardens,4.7,53.1842905,-6.1866837,"Powerscourt Demesne, Enniskerry, Co. Wicklow, Ireland","tourist_attraction, park, point_of_interest, establishment"
Experience Glasnevin - Ireland's National Cemetery,4.8,53.37003,-6.2770874,"Finglas Rd, Glasnevin, Dublin, D11 H2TH, Ireland","tourist_attraction, travel_agency, point_of_interest, establishment"
Bunratty Castle & Folk Park,4.6,52.70035559999999,-8.8122455,"Bunratty East, Bunratty, Co. Clare, Ireland","museum, tourist_attraction, park, point_of_interest, establishment"
Dublinia,4.5,53.34312689999999,-6.2719444,"St Michaels Hill Christ Church, Dublin 8, Ireland","tourist_attraction, museum, point_of_interest, establishment"
Killarney National Park,4.8,52.0058447,-9.5561803,"Co. Kerry, Ireland","tourist_attraction, park, point_of_interest, establishment"
Trim Castle,4.7,53.5544153,-6.789816,"Manorland (1st Division), Trim, Co. Meath, Ireland","tourist_attraction, point_of_interest, establishment"
The Spire,4.3,53.3498059,-6.2602557,"O'Connell Street Upper, North City, Dublin, Ireland","tourist_attraction, point_of_interest, establishment"
Irish Museum of Modern Art,4.3,53.3428506,-6.3006752,"Royal Hospital Kilmainham, Military Rd, Kilmainham, Dublin 8, D08 FW31, Ireland","museum, tourist_attraction, point_of_interest, establishment"
Irish Whiskey Museum,4.6,53.344198,-6.259525,"119 Grafton Street, Dublin, D02 E620, Ireland","museum, tourist_attraction, point_of_interest, establishment"
Kylemore Abbey & Victorian Walled Garden,4.6,53.56163919999999,-9.8893126,"Pollacappul, Co. Galway, Ireland","cafe, museum, tourist_attraction, store, food, church, place_of_worship, point_of_interest, establishment"
EPIC The Irish Emigration Museum,4.6,53.3482413,-6.248079799999999,"The Chq Building, Custom House Quay, North Wall, Dublin 1, Ireland","museum, tourist_attraction, travel_agency, point_of_interest, establishment"
Guinness Storehouse,4.4,53.3418088,-6.2867155,"St. James's Gate, Dublin 8, D08 VF8H, Ireland","tourist_attraction, food, point_of_interest, establishment"
Maynooth Castle,4.4,53.38082780000001,-6.5943071,"Maynooth Castle, Main St, Maynooth, Co. Kildare, Ireland","tourist_attraction, point_of_interest, establishment"
Kellogg's Skyline Croke Park,4.7,53.36054900000001,-6.250365700000001,"GAA Museum and Stadium Tour, Croke Park, St Joseph's Ave, Drumcondra, Dublin 3, Ireland","tourist_attraction, point_of_interest, establishment"
Irish Music Wall of Fame,4.4,53.34498989999999,-6.2643016,"Temple Ln S, Temple Bar, Dublin, Ireland","tourist_attraction, point_of_interest, establishment"
Molly Malone Statue,4.4,53.3437409,-6.260972499999999,"Suffolk St, Dublin 2, D02 KX03, Ireland","tourist_attraction, point_of_interest, establishment"
Malahide Castle & Gardens,4.6,53.44457670000001,-6.1655167,"Back Rd, Malahide Demesne, Malahide, Co. Dublin, Ireland","tourist_attraction, point_of_interest, establishment"
Brú na Bóinne Visitor Centre Newgrange and Knowth,4.6,53.69446989999999,-6.4465335,"Brú na Bóinne, Stalleen, Donore, Co. Meath, A92 EH5C, Ireland","museum, tourist_attraction, travel_agency, point_of_interest, establishment"
Glendalough Cathedral,4.7,53.0105285,-6.3270585,"Sevenchurches Or Camaderry, Glendalough, Co. Wicklow, Ireland","tourist_attraction, church, place_of_worship, point_of_interest, establishment"
The Viking Triangle,4.6,52.2603273,-7.1061785,"Bailey's New St, Waterford, Ireland","tourist_attraction, point_of_interest, establishment"
Walking Food Tours - (Dublin),5,53.3430672,-6.281217499999999,"St Catherine's Church of Ireland, Thomas St, The Liberties, Dublin 8, D08 DNA7, Ireland","tourist_attraction, point_of_interest, establishment"
Emerald Park,4.6,53.545298,-6.4594172,"Emerald Park, Kilbrew, Ashbourne, Co. Meath, A84 EA02, Ireland","zoo, amusement_park, tourist_attraction, point_of_interest, establishment"
Irish Folklore Park,4.6,54.041298,-6.177287799999999,"Ghan Rd, Liberties Of Carlingford, Carlingford, Co. Louth, Ireland","tourist_attraction, point_of_interest, establishment"
Viking Splash Tours,4.5,53.33910179999999,-6.2576678,"St Stephen's Green, North, Dublin 2, Ireland","tourist_attraction, point_of_interest, establishment"
Newgrange,4.6,53.69471189999999,-6.4754917,"Newgrange, Donore, Co. Meath, Ireland","tourist_attraction, point_of_interest, establishment"
Brú na Bóinne,4.7,53.694671,-6.475575,"Drogheda, Co. Meath, A92 EH5C, Ireland","tourist_attraction, park, point_of_interest, establishment"
Irish National War Memorial Gardens,4.8,53.3454498,-6.317255299999999,"Island Bridge, Ushers, Dublin, Ireland","tourist_attraction, park, point_of_interest, establishment"
The Irish Rock 'n' Roll Museum Experience,4.6,53.344926,-6.2644318,"Curved St, Temple Bar, Dublin, D02 RD26, Ireland","tourist_attraction, point_of_interest, establishment"
Athlone Castle Visitor Centre,4.4,53.4230603,-7.9428036,"Saint Peter's Tce, Athlone And Bigmeadow, Athlone, Co. Westmeath, N37 A6D7, Ireland","museum, tourist_attraction, travel_agency, point_of_interest, establishment"
Dún Na Sí Amenity & Heritage Park,4.7,53.40020639999999,-7.737636600000001,"Lake Road, Knockdomny, Moate, Co. Westmeath, N37 P271, Ireland","museum, tourist_attraction, park, point_of_interest, establishment"
National Trust - Carrick-a-Rede,4.6,55.2395335,-6.3324969,"Ballintoy, Antrim, Ballycastle, United Kingdom","tourist_attraction, point_of_interest, establishment"
National Museum of Ireland - Archaeology,4.6,53.3402225,-6.2549209,"35A Kildare St, Dublin 2, D02 YK38, Ireland","museum, tourist_attraction, point_of_interest, establishment"
Tullynally Castle & Gardens,4.7,53.6835994,-7.327166399999999,"Tullynally Pakenham Hall, Road, Castlepollard, Co. Westmeath, N91 HV58, Ireland","tourist_attraction, park, point_of_interest, establishment"
Dalkey Castle & Heritage Centre,4.6,53.27787989999999,-6.105544,"Castle St, Dalkey, Dublin, A96 DE61, Ireland","museum, tourist_attraction, travel_agency, point_of_interest, establishment"
The Lost Valley,4.7,53.6448125,-9.879978999999999,"Silver Strand, Doovilra, Louisburgh, Co. Mayo, Ireland","tourist_attraction, point_of_interest, establishment"
Dublin City,4.8,53.34981939999999,-6.260239599999999,"North City, Dublin, Ireland","tourist_attraction, point_of_interest, establishment"
National Botanic Gardens,4.8,53.3725493,-6.271907,"Glasnevin, Dublin 9, D09 VY63, Ireland","tourist_attraction, park, point_of_interest, establishment"
Arkle Memorial Statue,4.8,53.5129581,-6.399388099999999,"Killegland, Ashbourne, Co. Meath, Ireland","tourist_attraction, point_of_interest, establishment"
National Trust - Gleno,4.6,54.799498,-5.8324109,"Waterfall Rd, Gleno, Larne BT40 3LE, United Kingdom","tourist_attraction, point_of_interest, establishment"
Farmleigh House & Estate,4.7,53.36519209999999,-6.3597857,"White's Rd, Phoenix Park, Dublin 15, D15 TD50, Ireland","tourist_attraction, point_of_interest, establishment"
Loughcrew Megalithic Centre,4.7,53.745566,-7.121534899999999,"Loughcrew, Drumsawry Or Summerbank, Oldcastle, Co. Meath, Ireland","tourist_attraction, campground, travel_agency, cafe, museum, park, lodging, store, food, point_of_interest, establishment"
World Poverty Stone,4.5,53.3479863,-6.249372399999999,"North Wall, Dublin, Ireland","tourist_attraction, point_of_interest, establishment"
Dún Laoghaire Harbour,4.7,53.2956349,-6.133322199999999,"Harbour Rd, Dún Laoghaire, Co. Dublin, Ireland","tourist_attraction, point_of_interest, establishment"
The Wishing Hand,4.1,53.35095,-6.2579064,"77 Marlborough St, North City, Dublin 1, Ireland","tourist_attraction, point_of_interest, establishment"
Four Knocks Tomb,4.6,53.5965655,-6.326491499999999,"Fourknocks, Stamullen, Co. Meath, Ireland","tourist_attraction, point_of_interest, establishment"
Giant's Causeway,4.7,55.2408073,-6.5115554,"Bushmills BT57 8SU, United Kingdom","tourist_attraction, park, point_of_interest, establishment"
Dubh Linn Garden,4.6,53.3423616,-6.266632,"Dublin Castle, Dame St, Dublin, Ireland","park, tourist_attraction, point_of_interest, establishment"
The Book of Kells Experience,4.4,53.3439056,-6.2567428,"Trinity Long Room, The University of Dublin Trinity College, College Green, South-East Inner City, Dublin, Ireland","tourist_attraction, point_of_interest, establishment"
National Museum of Ireland - Natural History,4.5,53.33988480000001,-6.253347799999999,"Merrion St Upper, Dublin 2, D02 F627, Ireland","tourist_attraction, museum, point_of_interest, establishment"
Dublin Zoo,4.6,53.3572232,-6.3071091,"Phoenix park, Saint James, Dublin, D08 AC98, Ireland","zoo, tourist_attraction, point_of_interest, establishment"
Malahide Beach,4.6,53.45131720000001,-6.1386823,"Robswalls, Co. Dublin, Ireland","tourist_attraction, point_of_interest, establishment"
Swords Round Tower,4.5,53.4576831,-6.2244591,"56 St Columba's Rise, Swords Glebe, Swords, Co. Dublin, K67 V6R7, Ireland","tourist_attraction, point_of_interest, establishment"
Muckross House,4.7,52.0180696,-9.5041358,"Muckross, Killarney, Co. Kerry, Ireland","museum, tourist_attraction, store, restaurant, food, point_of_interest, establishment"
Dublin Falconry,5,53.3769708,-6.4337759,"Kellytown rd, Woodlands, Dublin, D15 RH92, Ireland","tourist_attraction, point_of_interest, establishment"
Rock of Cashel,4.6,52.5200763,-7.890452199999999,"St. Patricksrock, Cashel, Co. Tipperary, Ireland","tourist_attraction, point_of_interest, establishment"
Blarney Castle & Gardens,4.7,51.9290922,-8.570884699999999,"Blarney, Cork, Ireland","tourist_attraction, park, point_of_interest, establishment"
Ireland's Oldest Bridge,4.7,53.5560825,-6.7910203,"Bridge St, Townparks North, Trim, Co. Meath, Ireland","tourist_attraction, point_of_interest, establishment"
Rock of Dunamase,4.8,53.0319172,-7.2107266,"Park Or Dunamase, Dunamaise, Co. Laois, Ireland","tourist_attraction, point_of_interest, establishment"
The Famine Memorial,4.7,53.3480473,-6.2500367,"Custom House Quay, North Wall, Dublin, Ireland","tourist_attraction, point_of_interest, establishment"
Ha'penny Bridge,4.5,53.3463347,-6.263102900000001,"Bachelors Walk, North City, Dublin, Ireland","tourist_attraction, point_of_interest, establishment"
Molly Malone Statue,4.4,53.3437409,-6.260972499999999,"Suffolk St, Dublin 2, D02 KX03, Ireland","tourist_attraction, point_of_interest, establishment"
Glendalough Cathedral,4.7,53.0105285,-6.3270585,"Sevenchurches Or Camaderry, Glendalough, Co. Wicklow, Ireland","tourist_attraction, church, place_of_worship, point_of_interest, establishment"
Old Dublin City Wall,4.3,53.3431041,-6.2751245,"Lamb Alley, The Liberties, Dublin, Ireland","point_of_interest, establishment"
Maiden Tower,4.5,53.7226253,-6.2515588,"4-8 St Marys, Mornington, Co. Meath, A92 K7P1, Ireland","point_of_interest, establishment"
O'Brien's Tower,4.5,52.9731764,-9.430655699999999,"Burren Way, Lislorkan North, Co. Clare, Ireland","point_of_interest, establishment"
Kylemore Abbey & Victorian Walled Garden,4.6,53.56163919999999,-9.8893126,"Pollacappul, Co. Galway, Ireland","tourist_attraction, cafe, museum, church, food, place_of_worship, point_of_interest, store, establishment"
Dublin Castle,4.3,53.34288609999999,-6.2674284,"Dame St, Dublin 2, Ireland","tourist_attraction, point_of_interest, establishment"
Kilmainham Gaol,4.7,53.34187009999999,-6.309804799999999,"Inchicore Rd, Kilmainham, Dublin 8, D08 RK28, Ireland","museum, tourist_attraction, point_of_interest, establishment"
Guinness Storehouse,4.4,53.3418088,-6.2867155,"St. James's Gate, Dublin 8, D08 VF8H, Ireland","tourist_attraction, food, point_of_interest, establishment"
The Oscar Wilde Monument,4.5,53.3408162,-6.2505294,"1 Merrion Square E, Dublin, Ireland","tourist_attraction, point_of_interest, establishment"
Waterfall Iveagh Gardens,4.6,53.3354089,-6.2618513,"2 Stable Ln, Saint Kevin's, Dublin 2, D02 WV58, Ireland","tourist_attraction, point_of_interest, establishment"
Arkle Memorial Statue,4.8,53.5129581,-6.399388099999999,"Killegland, Ashbourne, Co. Meath, Ireland","tourist_attraction, point_of_interest, establishment"
Blarney Stone,4.6,51.9290491,-8.5709865,"Blarney, Cork, T23 Y598, Ireland","tourist_attraction, point_of_interest, establishment"
Old Mellifont Abbey,4.6,53.7420012,-6.466275599999999,"Mellifont, Tullyallen Village, Co. Louth, A92 K682, Ireland","tourist_attraction, point_of_interest, establishment"
Cong Abbey,4.6,53.5402245,-9.2869092,"Abbey St, Cong South, Cong, Co. Mayo, Ireland","point_of_interest, establishment"
Newgrange,4.6,53.69471189999999,-6.4754917,"Newgrange, Donore, Co. Meath, Ireland","tourist_attraction, point_of_interest, establishment"
Kells Priory,4.7,52.53893739999999,-7.266671899999999,"Priory Grove, Kellsborough, Kells, Co. Kilkenny, R95 V184, Ireland","point_of_interest, establishment"
Wicklow Head Old Lighthouse,4.6,52.9651837,-6.002279,"Dunbur Head, Wicklow, Ireland","tourist_attraction, point_of_interest, establishment"
Malahide Castle & Gardens,4.6,53.44457670000001,-6.1655167,"Back Rd, Malahide Demesne, Malahide, Co. Dublin, Ireland","tourist_attraction, point_of_interest, establishment"
Dowth Passage Tomb,4.4,53.70383649999999,-6.4503688,"Dowth, Co. Meath, Ireland","tourist_attraction, point_of_interest, establishment"
Glencar Waterfall,4.7,54.3402088,-8.368521,"Largandoon, Glencar, Co. Leitrim, Ireland","tourist_attraction, point_of_interest, establishment"
Clare Abbey,4.5,52.82902379999999,-8.9689595,"Limerick Rd, Clareabbey, Ennis, Co. Clare, Ireland","tourist_attraction, place_of_worship, point_of_interest, establishment"
Spanish Arch,4.2,53.26972170000001,-9.0540085,"2 The Long Walk, Galway, Ireland","tourist_attraction, point_of_interest, establishment"
Black Castle,4.6,52.9811225,-6.030844999999999,"S Quay, Corporation Lands, Co. Wicklow, Ireland","tourist_attraction, point_of_interest, establishment"
Bective Abbey,4.7,53.582475,-6.702971499999999,"R161, Bective, Co. Meath, Ireland","tourist_attraction, point_of_interest, establishment"
World Poverty Stone,4.5,53.3479863,-6.249372399999999,"North Wall, Dublin, Ireland","tourist_attraction, point_of_interest, establishment"
Brú na Bóinne,4.7,53.694671,-6.475575,"Drogheda, Co. Meath, A92 EH5C, Ireland","tourist_attraction, park, point_of_interest, establishment"
Athlumney Castle,4.2,53.6502851,-6.6751391,"Convent Rd, Athlumney, Navan, Co. Meath, Ireland","tourist_attraction, point_of_interest, establishment"
Glendalough Roundtower,4.8,53.0109234,-6.3277136,"Knockfin, Co. Wicklow, Ireland","point_of_interest, establishment"
O'Connell Monument,4.4,53.34775819999999,-6.2593421,"O'Connell Street Lower, North City, Dublin 1, D01 TX31, Ireland","tourist_attraction, point_of_interest, establishment"
The Guinness Tower (1864),4.3,53.5371264,-9.2952108,"Cong North, Cong, Co. Mayo, Ireland","tourist_attraction, point_of_interest, establishment"
Brendan Behan Statue,4.4,53.3617401,-6.260250099999999,"Royal Canal Drumcondra 2nd Lock, Dorset Ln, Dublin, Ireland","tourist_attraction, point_of_interest, establishment"
Giant's Causeway,4.7,55.2408073,-6.5115554,"Bushmills BT57 8SU, United Kingdom","tourist_attraction, park, point_of_interest, establishment"
Beaghmore Stone Circles Landmark,4.7,54.7016225,-6.9391681,"64-62 Blackrock Rd, Cookstown BT80 9PA, United Kingdom","point_of_interest, establishment"
The Grey Abbey,4.6,53.1530613,-6.9143022,"Grey Abbey Rd, Kildare, Ireland","tourist_attraction, point_of_interest, establishment"
Experience Glasnevin - Ireland's National Cemetery,4.8,53.37003,-6.2770874,"Finglas Rd, Glasnevin, Dublin, D11 H2TH, Ireland","tourist_attraction, travel_agency, point_of_interest, establishment"
Dublinia,4.5,53.34312689999999,-6.2719444,"St Michaels Hill Christ Church, Dublin 8, Ireland","tourist_attraction, museum, point_of_interest, establishment"
St. Kevin's Bed,4.7,53.00402099999999,-6.354656299999999,"Lugduff, Glendalough, Co. Wicklow, Ireland","tourist_attraction, point_of_interest, establishment"
Christ Church Cathedral,4.5,53.34351299999999,-6.2710602,"Christchurch Pl, Wood Quay, Dublin, D08 TF98, Ireland","tourist_attraction, church, place_of_worship, point_of_interest, establishment"
Cahir Castle,4.6,52.3745471,-7.9270751,"Castle St, Townparks, Cahir, Co. Tipperary, E21 P652, Ireland","tourist_attraction, point_of_interest, establishment"
Kilcooley Abbey,4.4,52.6707686,-7.571309400000001,"Kilcoolyabbey, Kilcooley Abbey, Co. Tipperary, Ireland","tourist_attraction, point_of_interest, establishment"
St. Michael’s Tower the Archangel,4.8,53.3431106,-6.2719514,"Merchants Quay, Dublin, Ireland","point_of_interest, establishment"
Free Derry Corner,4.7,54.9957684,-7.326761,"Lecky Rd, Glenfada Park, Londonderry BT48 9DR, United Kingdom","tourist_attraction, point_of_interest, establishment"
Donaghmore Round Tower,4.5,53.670453,-6.662465099999999,"Donaghmore, Co. Meath, Ireland","point_of_interest, establishment"
Red Abbey Tower,4.1,51.8940803,-8.4723037,"Red Abbey St, Ballintemple, Cork, Ireland","tourist_attraction, point_of_interest, establishment"
Kilgowan Standing Stone,4.6,53.077985,-6.763614,"Whitehall, Co. Kildare, Ireland","point_of_interest, establishment"
Castledermot Abbey,4.6,52.9083894,-6.836797499999999,"Abbeyland, Castledermot, Co. Kildare, Ireland","tourist_attraction, museum, point_of_interest, establishment"
Kinnitty Pyramid,4.4,53.0961676,-7.719945699999999,"Ballyshane Rd, Lismoney, Co. Offaly, Ireland","point_of_interest, establishment"
St. Patrick's Tower at The Digital Hub,4.5,53.3439852,-6.2840836,"The Digital Hub, Roe Ln, The Liberties, Dublin, Ireland","tourist_attraction, point_of_interest, establishment"
Farmleigh Clock Tower,4.6,53.3633681,-6.362724,"Castleknock, Co. Dublin, Ireland","tourist_attraction, point_of_interest, establishment"
Corcomroe Abbey,4.7,53.1268421,-9.0540065,"Corcomroe Rd, Abbey West, Co. Clare, Ireland","point_of_interest, establishment"
Sandycove Castle,4.7,53.287178,-6.114911999999999,"9 Sandycove Ave W, Bullock, Dublin, A96 A5N5, Ireland","tourist_attraction, point_of_interest, establishment"
Lissenhall Medieval Bridge,4.2,53.47109,-6.212251999999999,"Broadmeadow Rd, River Valley, Swords, Co. Dublin, Ireland","point_of_interest, establishment"
Clock Tower,4.6,53.3715632,-6.175176400000001,"St Anne's Park, Clontarf East, Dublin 5, D18 XT21, Ireland","point_of_interest, establishment"
Dublin Castle,4.3,53.34288609999999,-6.2674284,"Dame St, Dublin 2, Ireland","tourist_attraction, point_of_interest, establishment"
Ireland's Oldest Bridge,4.7,53.5560825,-6.7910203,"Bridge St, Townparks North, Trim, Co. Meath, Ireland","tourist_attraction, point_of_interest, establishment"
Donadea Castle,4.7,53.3410255,-6.7470873,"Donadea Demesne, Co. Kildare, Ireland","tourist_attraction, point_of_interest, establishment"
Trim Castle,4.7,53.5544153,-6.789816,"Manorland (1st Division), Trim, Co. Meath, Ireland","tourist_attraction, point_of_interest, establishment"
Fore Abbey,4.7,53.683924,-7.227154,"Fore, Co. Westmeath, Ireland","tourist_attraction, point_of_interest, establishment"
Glendalough Cathedral,4.7,53.0105285,-6.3270585,"Sevenchurches Or Camaderry, Glendalough, Co. Wicklow, Ireland","tourist_attraction, church, place_of_worship, point_of_interest, establishment"
Kells Priory,4.7,52.53893739999999,-7.266671899999999,"Priory Grove, Kellsborough, Kells, Co. Kilkenny, R95 V184, Ireland","point_of_interest, establishment"
World Poverty Stone,4.5,53.3479863,-6.249372399999999,"North Wall, Dublin, Ireland","tourist_attraction, point_of_interest, establishment"
Brú na Bóinne Visitor Centre Newgrange and Knowth,4.6,53.69446989999999,-6.4465335,"Brú na Bóinne, Stalleen, Donore, Co. Meath, A92 EH5C, Ireland","tourist_attraction, travel_agency, museum, point_of_interest, establishment"
Custom House Visitor Centre,4.6,53.3483945,-6.253133,"Custom House Quay, North Wall, Dublin 1, D01 W6X0, Ireland","museum, point_of_interest, establishment"
Hill of Tara,4.5,53.5788114,-6.611649,"Castleboy, Co. Meath, Ireland","tourist_attraction, point_of_interest, establishment"
Donaghmore Round Tower,4.5,53.670453,-6.662465099999999,"Donaghmore, Co. Meath, Ireland","point_of_interest, establishment"
Parliament House,4.2,53.34471019999999,-6.2600514,"College Green, Temple Bar, Dublin, Ireland","tourist_attraction, point_of_interest, establishment"
Rathfarnham Castle,4.4,53.29814270000001,-6.2835816,"Rathfarnham Rd, Rathfarnham, Dublin, D14 K3T6, Ireland","tourist_attraction, museum, point_of_interest, establishment"
Knowth,4.8,53.70119829999999,-6.491428099999999,"Knowth, Drogheda, Co. Meath, A92 EH5C, Ireland","tourist_attraction, point_of_interest, establishment"
Irish National War Memorial Gardens,4.8,53.3454498,-6.317255299999999,"Island Bridge, Ushers, Dublin, Ireland","tourist_attraction, park, point_of_interest, establishment"
Kilmainham Gaol,4.7,53.34187009999999,-6.309804799999999,"Inchicore Rd, Kilmainham, Dublin 8, D08 RK28, Ireland","museum, tourist_attraction, point_of_interest, establishment"
Maynooth Castle,4.4,53.38082780000001,-6.5943071,"Maynooth Castle, Main St, Maynooth, Co. Kildare, Ireland","tourist_attraction, point_of_interest, establishment"
Priory of St John the Baptist,4.5,53.55520929999999,-6.7682765,"Ireland, Old Lackanash Road, Ireland","point_of_interest, establishment"
Bective Abbey,4.7,53.582475,-6.702971499999999,"R161, Bective, Co. Meath, Ireland","tourist_attraction, point_of_interest, establishment"
Rock of Cashel,4.6,52.5200763,-7.890452199999999,"St. Patricksrock, Cashel, Co. Tipperary, Ireland","tourist_attraction, point_of_interest, establishment"
"Leap Castle, Ireland",4.6,53.0279902,-7.808453399999999,"EIRCODE ? R421, Leap, Roscrea, Co. Offaly, Ireland","tourist_attraction, point_of_interest, establishment"
Loughcrew Cairns,4.8,53.744576,-7.112123,"Loughcrew Cairns, Corstown, Oldcastle, Co. Meath, Ireland","tourist_attraction, place_of_worship, travel_agency, point_of_interest, establishment"
Reginald's Tower,4.6,52.260499,-7.105403099999999,"The Quay, Waterford, Ireland","museum, tourist_attraction, point_of_interest, establishment"
Garden of Remembrance,4.6,53.3538817,-6.2641429,"Parnell Square E, Rotunda, Dublin 1, D01 A0F8, Ireland","tourist_attraction, park, point_of_interest, establishment"
Termonfeckin Castle,4.2,53.7602955,-6.2668358,"Strand Rd, Termonfeckin, Co. Louth, Ireland","point_of_interest, establishment"
Céide Fields,4.4,54.3070873,-9.457645699999999,"Glenurla, Co. Mayo, F26 PF66, Ireland","tourist_attraction, park, point_of_interest, establishment"
Carlingford Castle,4.3,54.0432392,-6.1868336,"King Johns Castle, Carlingford, Co. Louth, Ireland","tourist_attraction, point_of_interest, establishment"
Experience Glasnevin - Ireland's National Cemetery,4.8,53.37003,-6.2770874,"Finglas Rd, Glasnevin, Dublin, D11 H2TH, Ireland","tourist_attraction, travel_agency, point_of_interest, establishment"
Ashtown Castle,4.5,53.36577370000001,-6.3305907,"Phoenix Park, Dublin, Ireland","tourist_attraction, point_of_interest, establishment"
Dromiskin Monastic Site,4.5,53.9220098,-6.398171400000001,"16-34 Church View, Dromiskin, Co. Louth, A91 DD89, Ireland","tourist_attraction, point_of_interest, establishment"
Jerpoint Abbey,4.6,52.5108434,-7.1575191,"Jockeyhall, Thomastown, Co. Kilkenny, R95 P523, Ireland","tourist_attraction, point_of_interest, establishment"
Dalkey Castle & Heritage Centre,4.6,53.27787989999999,-6.105544,"Castle St, Dalkey, Dublin, A96 DE61, Ireland","tourist_attraction, museum, travel_agency, point_of_interest, establishment"
Old Kilcullen Round Tower,4.7,53.107931,-6.761016,"Oldkilcullen, Old Kilcullen, Co. Kildare, Ireland","point_of_interest, establishment"
Castle Saunderson,4.5,54.1267696,-7.3595443,"Castlesaunderson Demesne, Co. Cavan, Ireland","point_of_interest, establishment"
National Museum of Ireland - Archaeology,4.6,53.3402225,-6.2549209,"35A Kildare St, Dublin 2, D02 YK38, Ireland","tourist_attraction, museum, point_of_interest, establishment"
Boyle Abbey,4.6,53.9739243,-8.2975804,"Knocknashee, Boyle, Co. Roscommon, F52 XE16, Ireland","point_of_interest, establishment"
Newgrange,4.6,53.69471189999999,-6.4754917,"Newgrange, Donore, Co. Meath, Ireland","tourist_attraction, point_of_interest, establishment"
Lia Fáil (Stone of Destiny),4.7,53.57862979999999,-6.6121414,"Unnamed Road, Co. Meath, Ireland","point_of_interest, establishment"
Portumna Castle & Gardens,4.5,53.08660099999999,-8.220731700000002,"Portumna Demesne, Portumna, Co. Galway, Ireland","point_of_interest, establishment"
Sandycove Castle,4.7,53.287178,-6.114911999999999,"9 Sandycove Ave W, Bullock, Dublin, A96 A5N5, Ireland","tourist_attraction, point_of_interest, establishment"
Kildrought House,4.7,53.3403371,-6.537807399999999,"Main St, Celbridge, Co. Kildare, Ireland","tourist_attraction, museum, point_of_interest, establishment"
